{
  "schema_version": "public-exposure-contract-v0",
  "contract_digest_binding": {
    "candidate_digest": "aaaaaaaaaaaaaaaaaaaaaaaaaaaaaaaaaaaaaaaaaaaaaaaaaaaaaaaaaaaaaaaa",
    "payload_digest": "sha256:bbbbbbbbbbbbbbbbbbbbbbbbbbbbbbbbbbbbbbbbbbbbbbbbbbbbbbbbbbbbbbbb"
  },
  "public_candidate_conversion": {
    "objective_item": 9,
    "enabled": false,
    "serving_enabled": false,
    "stored_public_card": false,
    "required_gates": ["PR-003", "PR-005", "PR-006", "REVIEWER_PUBLISH"]
  },
  "b2b_respondent_portal": {
    "objective_item": 10,
    "enabled": false,
    "b2b_delivery_enabled": false,
    "response_available": false,
    "required_gates": ["ED-005", "MODERATION_WORKFLOW", "NO_DISCLOSURE_NEGATIVE_TESTS", "RESPONDENT_POLICY"]
  },
  "company_store_dashboard": {
    "objective_item": 13,
    "enabled": false,
    "dashboard_enabled": false,
    "aggregate_signal_available": false,
    "required_gates": [
      "AGGREGATE_PRIVACY_THRESHOLD_POLICY",
      "AGGREGATE_SIGNAL_POLICY",
      "CORRECTION_TAKEDOWN_POLICY",
      "DASHBOARD_DISPLAY_POLICY",
      "DASHBOARD_EXPORT_DOWNLOAD_POLICY",
      "FAIR_REVIEW_PRESENTATION_POLICY",
      "MANIPULATION_RESISTANCE_POLICY",
      "MIN_SOURCE_COUNT_POLICY",
      "MODERATION_WORKFLOW",
      "NO_ESCROW_ARTIFACT_DISPLAY_TESTS",
      "NO_IDENTITY_LEAKAGE_TESTS",
      "NO_SINGLE_OBSERVATION_DISPLAY_TESTS",
      "NO_SUPPRESSION_SURFACE_TESTS",
      "PUBLIC_B2B_DISCLOSURE_POLICY"
    ]
  },
  "forbidden_outputs": {
    "public_candidate_conversion": [
      "submitter_identity",
      "raw_source_material",
      "private_selection_status",
      "staff_identity",
      "raw_review_body",
      "non_public_operational_detail"
    ],
    "b2b_respondent_portal": [
      "submitter_identity",
      "raw_source_material",
      "device_or_network_signal",
      "reidentification_hint",
      "protected_fingerprint",
      "raw_review_body",
      "source_metadata",
      "raw_moderation_evidence",
      "escrow_ciphertext",
      "escrow_handle",
      "escrow_key_material",
      "reviewer_private_note",
      "non_public_operational_detail",
      "respondent_visible_user_attribution"
    ],
    "company_store_dashboard": [
      "submitter_identity",
      "raw_source_material",
      "device_or_network_signal",
      "reidentification_hint",
      "protected_fingerprint",
      "raw_review_body",
      "source_metadata",
      "raw_moderation_evidence",
      "escrow_ciphertext",
      "escrow_handle",
      "escrow_key_material",
      "account_identifier",
      "match_status",
      "individual_claim",
      "single_observation_detail",
      "reviewer_private_note",
      "non_public_operational_detail"
    ]
  }
}
